{
  "version": 2,
  "accountId": "11111111-1111-4111-8111-111111111111",
  "deviceId": "22222222-2222-4222-8222-222222222222",
  "storeName": "Mercado Central",
  "occurrenceTime": "2026-07-12T12:30:00.000Z",
  "currencyCode": "BRL",
  "oneItemPurchase": {
    "expectedItems": 1,
    "expectedTotalMinorUnits": 1299
  },
  "multiItemPurchase": {
    "expectedItems": 2,
    "expectedTotalMinorUnits": 1799
  },
  "invalidItemRollback": {
    "invalidPackageCount": 0,
    "expectedPurchasesAfterFailure": 0,
    "expectedPurchaseItemsAfterFailure": 0,
    "expectedPendingEventsAfterFailure": 0
  },
  "closeReopen": {
    "expectedPurchasesAfterReopen": 1,
    "expectedPendingEventsAfterReopen": 1
  }
}
